{
  "schemaVersion": "1.0",
  "type": "module",
  "slug": "hotline",
  "name": "PBB Hotline",
  "productName": "Vox",
  "productFamily": "Auxilus Mos",
  "category": "emergency-operations",
  "heroImageKey": "moduleHotlineHero",
  "shortDescription": "Local emergency intake, incident handling, command reporting, and support coordination for barangay and command nodes.",
  "longDescription": [
    "PBB Hotline / Vox is the local emergency operations surface for citizens, operators, command users, and administrators. It supports emergency intake, incident work, team assignment, command alerts, SITREP preparation, and support requests from a PBB node.",
    "The module uses local node services for live communication and maps. Its confirmed upstream paths are selective: completed SITREP and support-request workflows can be handed to Relay, while editable incident records are not broadly replicated between nodes."
  ],
  "primaryUsers": ["Citizens", "Barangay emergency operators", "Command staff", "Local administrators"],
  "deployment": {
    "classification": "baseline",
    "placements": ["barangay-node", "local-command-node"]
  },
  "readiness": {
    "status": "integrated",
    "qualifier": "pilot-ready-foundation",
    "note": "Core citizen, operator, command, SITREP, support-request, Realtime, and MapServer workflows are implemented and integrated.",
    "remainingWork": [
      "Define production retention and media-handling policy.",
      "Complete deployment runbooks and security hardening.",
      "Document browser behavior during complete local network loss."
    ]
  },
  "problemSolved": "During an emergency, reports can arrive through fragmented calls and messages while operators lack a shared local view. Vox provides one node-local workflow for intake, incident handling, command reporting, and requests for outside support.",
  "workflowSteps": [
    { "id": "report", "title": "Report locally", "description": "A citizen reaches the local Hotline surface and starts an emergency report while connected to the node network." },
    { "id": "triage", "title": "Triage and coordinate", "description": "Operators review incident details, location, resources, team assignments, messages, and media in the local workbench." },
    { "id": "command", "title": "Build command context", "description": "Command staff issue alerts and prepare structured situation reports from local operational information." },
    { "id": "handoff", "title": "Send selected updates", "description": "SITREPs and support requests can enter Relay-backed delivery and retry workflows when the route upstream is available." }
  ],
  "offlineBehavior": {
    "localCapabilities": [
      "Citizen intake, operator incident work, command reporting, messages, and local media storage can continue over the node LAN while the app and database are available.",
      "SITREP and support-request delivery records can persist locally for server-side retry."
    ],
    "requiresLocalServices": [
      "PBB Realtime is required for supported live presence, call, message, and media events.",
      "PBB MapServer must be prepared and available for offline tiles and boundaries."
    ],
    "syncsWhenConnected": [
      "The latest SITREP can be handed to PBB Relay through a persisted delivery path.",
      "Support requests and their confirmed lifecycle updates can move through Relay and PBB Support System."
    ],
    "connectivityRequired": [
      "Delivery to an upstream or peer node waits for a reachable Relay route.",
      "Map cache misses may require an upstream tile provider if the requested area was not prepared."
    ],
    "notSynchronized": [
      "No durable browser-side citizen report outbox is confirmed.",
      "Editable incident records are not broadly synchronized between nodes."
    ]
  },
  "screenshots": [
    {
      "id": "citizen-home",
      "type": "image",
      "imageKey": "hotline-citizen-home",
      "src": "assets/gallery/screenshots/PBB Hotline - Citizen Home.png",
      "title": "Citizen call-for-help screen",
      "caption": "The citizen-facing Hotline home screen provides a clear press-and-hold control for starting a local emergency call.",
      "alt": "PBB Hotline citizen home screen with the Call for Help control",
      "width": 378,
      "height": 668
    },
    {
      "id": "citizen-operator-availability",
      "type": "image",
      "imageKey": "hotline-citizen-availability",
      "src": "assets/gallery/screenshots/PBB Hotline - Citizen Operators Available.png",
      "title": "Citizen operator availability",
      "caption": "The citizen interface confirms Hotline readiness, operator availability, call-service status, and backend reachability.",
      "alt": "PBB Hotline citizen home screen confirming that an operator and call services are available",
      "width": 377,
      "height": 668
    },
    {
      "id": "operator-dashboard",
      "type": "image",
      "imageKey": "hotline-operator-dashboard-current",
      "src": "assets/gallery/screenshots/PBB Hotline - Operator Dashboard.png",
      "title": "Operator operations dashboard",
      "caption": "The operator dashboard combines the local operational map, active and archived incidents, and dispatch status columns.",
      "alt": "PBB Hotline operator dashboard with a local map and incident status columns",
      "width": 1917,
      "height": 941
    },
    {
      "id": "operator-workbench",
      "type": "image",
      "imageKey": "hotline-operator-workbench",
      "src": "assets/gallery/screenshots/PBB Hotline - Operator Workbench.png",
      "title": "Operator incident workbench",
      "caption": "The incident workbench brings together caller and location details, incident fields, dispatch progress, call sessions, and chat evidence.",
      "alt": "PBB Hotline operator workbench showing incident details, dispatch, call sessions, and caller chat",
      "width": 1915,
      "height": 938
    },
    {
      "id": "command-dashboard",
      "type": "image",
      "imageKey": "hotline-command-dashboard",
      "src": "assets/gallery/screenshots/PBB Hotline - Command Dashboard.png",
      "title": "Command operations dashboard",
      "caption": "The command view combines the operational map, alert state, current SITREP, incident context, and response assignments.",
      "alt": "PBB Hotline command dashboard showing the operational map, current SITREP, incidents, and response assignments",
      "width": 1915,
      "height": 939
    },
    {
      "id": "command-sitrep-viewer",
      "type": "image",
      "imageKey": "hotline-command-sitrep",
      "src": "assets/gallery/screenshots/PBB Hotline - Command SITREP Viewer.png",
      "title": "Command SITREP preview",
      "caption": "Command users can review a structured Daily SITREP and its publication status before publishing, printing, or downloading it.",
      "alt": "PBB Hotline command SITREP preview with publish, print, and download controls",
      "width": 1057,
      "height": 722
    },
    {
      "id": "command-support-request",
      "type": "image",
      "imageKey": "hotline-command-support-request",
      "src": "assets/gallery/screenshots/PBB Hotline - Command Support Request.png",
      "title": "Upstream support request",
      "caption": "The command workflow records urgency, requested quantity, escalation justification, linked incidents, and notes for upstream support.",
      "alt": "PBB Hotline command form for requesting upstream equipment and support",
      "width": 797,
      "height": 657
    }
  ],
  "faqs": [
    { "id": "internet-down", "question": "Can Hotline keep working when the internet is down?", "answer": "Yes, local work can continue while Hotline and its supporting services are running on the local PBB network. Messages meant for another node will wait until a connection becomes available." },
    { "id": "browser-outbox", "question": "Can a citizen submit a report after leaving the local network?", "answer": "Not reliably. The current design does not confirm that a browser can save a report while disconnected and send it later. Hotline's offline support applies within the local PBB network." },
    { "id": "incident-sync", "question": "Are live incident records copied to every PBB node?", "answer": "No. Full editable incident records are not copied everywhere. Nodes send only selected situation reports and support-request updates through Relay." },
    { "id": "realtime", "question": "What does PBB Realtime provide to Vox?", "answer": "PBB Realtime supports live updates for who is connected, calls, messages, media, and other app activity. One shared Realtime service is expected to run on each node." },
    { "id": "maps", "question": "Will maps always be available offline?", "answer": "No. Only map areas and boundaries prepared in advance will work reliably offline. Looking outside those prepared areas may require internet access." },
    { "id": "support-requests", "question": "How does Vox ask another operations team for support?", "answer": "Vox saves the request locally, then Relay can send the approved request details to a designated PBB Support node. That node can return updates as the request is handled." }
  ],
  "relatedModules": ["support", "salus", "utility"],
  "relatedInfrastructure": ["relay", "realtime", "mapserver", "account"],
  "seo": {
    "title": "PBB Hotline / Vox | Local emergency operations",
    "description": "See how PBB Hotline / Vox supports local emergency intake, incident handling, SITREPs, support requests, Realtime, and prepared offline maps."
  }
}
